Job ID,Job Title,Job URL,Diversity Job,Employer,Location,Salary,Date Posted,Description,Position Type 0.0,Position Type 0.1,Position Type 0.2,Position Type 0.3,Position Type 0.4,Position Type 0.5,Position Type 0.6,Position Type 0.7,Position Type 0.8,Position Type 0.9,Position Type 1.0,Position Type 1.1,Position Type 1.2
37377983,Assistant Professor,https://jobs.chronicle.com/job/37377983/assistant-professor/,False,University of Maryland,"College Park, Maryland","Up to $80,000",2022-12-14,"The Department of Art at the University of Maryland invites applications for a tenure-track Assistant Professor position in Graphic Design. We seek an individual who can equip students with traditional graphic design, motion graphics, and emerging digital technologies (UX/UI, AR, and VR). The successful candidate will possess an understanding of graphic and interactive design’s critical, historical, and theoretical aspects and engage in evolving practices in the field.
 
This candidate will be able to apply this understanding to different areas within interactive design and be willing to collaborate on building a curriculum for a 21st-Century design program that encompasses the innovative platforms of 2D, 3D, interactive work, VR, and AR. This individual should be eager to contribute to a forward-thinking program and will cultivate positive relationships and motivate students in a highly collaborative environment.
 
The Graphic Design Concentration at the University of Maryland is rooted in an appreciation of graphic design as a vehicle for social change. An ideal candidate should demonstrate an affinity for this principle through their scholarly or professional and creative background. The successful candidate should skillfully articulate a vision of graphic design education in the 21st century that aligns with the department’s mission on how graphic design can communicate and address social issues and injustice.
 
In addition, the Department of Art at the University of Maryland is embarking on an ambitious interdisciplinary new academic program; a dual-track major in Immersive Media Design. Candidates whose professional or scholarly research emphasizes new and emerging technology use within the field are strongly encouraged to apply.
The University of Maryland is an equal opportunity employer. The Department of Art is committed to increasing the diversity of the campus community. Candidates who have experience working with a diverse range of faculty, staff and students, and who can contribute to the climate of inclusivity, are encouraged to identify their experiences in these areas. Minorities and women who explore themes of identity, social categorizations, intersectionality, race, class, gender, and sexual orientation are encouraged to apply. This search is contingent upon the continued availability of funds. For best consideration, submit application materials by 1/23/23
 
Expectations/Responsibilities
Research:

Maintain an active practice of creative research with a national and international trajectory through client-based practice, exhibition, publication, curatorial projects or other engagement in Graphic Design.

Teaching:

Teach two undergraduate courses per semester in a range of Graphic Design courses based upon the applicant’s areas of expertise and departmental need.
Advise and mentor in the Graphic Design concentration.
Advise and mentor undergraduate students in our Departmental Honors Program on an individual basis, and participate in a variety of group critiques with the collective Honors faculty.
Advise and mentor MFA students in all disciplines on an individual basis, and take part in semester reviews with the collective graduate faculty.
Serve as Director or committee member on MFA thesis committees.

 
Service:

Provide guidance in the adoption of emerging technologies in the Department of Art across disciplines, with particular attention paid to the Graphic Design concentration.
Participate in the ongoing governance of the Department of Art and Immersive Media Design.

 
Minimum Qualifications: 

An MFA or equivalent terminal degree from an accredited institution.
Demonstrable investment in the uses and implications of emerging technologies in the field of Graphic Design.
A record of active creative research, as demonstrated through client-based practice, exhibition or publication that shows potential for national or international recognition.

 
Preferences: 

2 years of teaching experience at the university or college level

 
",Faculty Positions,Arts,Art,Design & Graphic Arts,,,,,,,,,
37378069,"Tenure Track Assistant Professor, English and Media Studies",https://jobs.chronicle.com/job/37378069/tenure-track-assistant-professor-english-and-media-studies/,False,Bentley University,"Massachusetts, United States",Salary Not specified,2022-12-14,"
Bentley University



Job Description Summary
The Department of English and Media Studies at Bentley
University-an independent, private business-oriented university
located in suburban Boston-invites applications for a tenure-track
Assistant Professor position, to begin in Fall 2023.

Core pedagogical duties will include teaching Critical Reading and
Writing and Multimodal Communication, the first-year writing and
communication sequence required of all students.

The successful candidate will also be able teach the Falcon
Discovery Seminar, our first-year seminar that combines academic
content and extended orientation, and offer courses in one or more
of the following fields: literature, creative writing,
communication studies, media studies, and/or cinema studies.
Experience in curriculum design, development, and leadership is
strongly preferred.

Bentley is committed to the teacher-scholar model where teaching,
scholarship, and service excellence are expected and valued. The
successful candidate will be evaluated on Bentley's teaching
profile. Tenure-track and tenured faculty in English and Media
Studies are on four different profiles - scholarly, standard,
service, or teaching - depending on their roles and ranks. This
position emphasizes teaching and curricular leadership.

English and Media Studies contributes to undergraduate degrees in
English, Media and Culture, and Creative Industries. The department
also teaches the two foundational courses that comprise the
required first-year writing and communication sequence as well as a
variety of courses to help students meet their Contexts and
Perspectives in the Arts and Sciences general education
requirements.

Minimum Qualifications:

Ph.D. in English, Communication, or related field required. Prior
teaching experience as an instructor of record for at least six
semesters/nine quarters at the college level is required. Internal
applicants are invited to apply.

Special Instructions to Applicants:

Application materials should be submitted through Bentley's on-line
employment site at https://bentley.wd1.myworkdayjobs.com/faculty
. For full consideration, please apply by January 30, 2023.

Candidates should submit the following as part of the application:
cover letter, curriculum vitae, statement of teaching philosophy,
sample syllabus, writing sample up to a maximum of 30 pages, and a
diversity statement. The diversity statement should be a maximum of
two pages and speak to your experience with diversity (i.e.,
gender, race, ethnicity, age, religious or other backgrounds)
and/or inclusion (all members of an organization are valued,
respected, and have influence) and how it relates to your research,
teaching, or service. Bentley University recognizes that your
individual exposure to diversity is a function of your background.
We value those from relatively homogenous cultural contexts as well
as those from diverse cultural contexts, whether in the U.S. or
internationally, where diversity may take on different forms.The
names and contact information for three professional references.
Bentley will contact these confidential references for those
candidates moving forward in the process.

Bentley University requires references checks and may conduct other
pre-employment screening.

DIVERSITY STATEMENT

Bentley University strives to create a campus community that
welcomes the exchange of ideas, and fosters a culture that values
differences and views them as a strength in our community.

Bentley University is an Equal Opportunity Employer, building
strength through diversity. The University is committed to building
a community of talented students, faculty and staff who reflect the
diversity of global business. We strongly encourage applications
from persons from underrepresented groups, individuals with
disabilities, covered veterans and those with diverse experiences
and backgrounds.

PI199203254
",Faculty Positions,Humanities,English & Literature,Other Humanities,,,,,,,,,
37378205,Assistant Professor of TESOL,https://jobs.chronicle.com/job/37378205/assistant-professor-of-tesol/,False,University of Wisconsin-River Falls,"River Falls, Wisconsin",Competitive,2022-12-14,"The University of Wisconsin River Falls, a member of the University of Wisconsin System, is located in scenic west central Wisconsin, 30 miles from the multi-cultural, multi-ethnic cities of Minneapolis and St Paul. Year-round arts, cultural and recreational events are easily accessible from River Falls. UWRF's undergraduate and graduate students pursue degrees in four colleges: Arts and Sciences, Education and Professional Studies; Agriculture, Food and Environmental Sciences; and Business and Economics.
The University provides an excellent environment for learning, emphasizing the importance of faculty-student interaction in classrooms, laboratories, academic advising, and co-curricular activities. A favorable student-faculty ratio affords opportunity for meaningful interchange between faculty and students. Strong interests in teaching, research and community service are highly valued. More information about UWRF can be found at: http://www.uwrf.edu/workhere/.
 
Position Summary:
Tenure-track faculty member with experience in TESOL – Applied Linguistics, working with existing TESOL faculty to deliver TESOL academic programming to students.
Responsibilities:
This position directly supports coursework in applied linguistics at the graduate and undergraduate level, potentially teaching pedagogical grammar, educational linguistics, the history of language, the structure of English, ESL tutoring practicum, and vocabulary teaching. Colleagues in the department teach a normal load of eight courses a year. Within that load, teaching in the General Education program may, at times, be required. However, the primary responsibilities of this faculty position are to teach TESOL courses at both the graduate and undergraduate level; help maintain and update the curriculum; direct graduate theses and research studies; continually engage in the field of applied linguistics through teaching, research, and service; support the development of student internships, service learning, and other high-impact practices in the TESOL area; and maintain graduate faculty status.

The faculty member is expected to stay abreast of research in their field of study, maintain an active research agenda, and fulfill service responsibilities within the department and at the college and university levels.
Knowledge, Skills and Abilities:
The position requires a Ph.D. in Applied Linguistics, Second Language Acquisition, or TESOL (no later than July 1, 2023). Experience teaching at the undergraduate level and teaching online are required.

Extremely desirable (but not required) is the holding of an ESL teaching license or ability to obtain one, fluency in a second language, experience with or interest in teaching and mentoring graduate students, and / or experience with or interest in developing or leading study abroad programs.
 
Application:
Applicants are required to apply online. UWRF will not consider paper, emailed or faxed applications. Applicants are required to provide:

Curriculum Vitae
Unofficial Transcripts
Teaching Philosophy
Letter of interest specifying qualifications and experience (cover letter)
Names, addresses, telephone numbers and email addresses of at least three references who can specifically comment upon your teaching ability, experience and professional preparation (references)

Inquiries should be addressed to:
Doug Margolis
Search Chair
douglas.margolis@uwrf.edu
Deadline to Apply: Initial review of applications will begin upon receipt. For full consideration, applicants should submit all required materials by January 19, 2023. 
View our excellent benefits at: https://www.wisconsin.edu/ohrwd/benefits/download/fasl.pdf
 
",Faculty Positions,Humanities,English & Literature,English as a Second Language,,,,,,,,,
37378177,"Assistant Professor, Food/Nutrition Insecurity",https://jobs.chronicle.com/job/37378177/assistant-professor-food-nutrition-insecurity/,False,University of Illinois at Urbana-Champaign,"Urbana, Illinois",Competitive salary with benefits and start-up package is commensurate with qualifications.,2022-12-14,"Apply at:
https://go.fshn.illinois.edu/FoodNutritionInsecurity
WE TRANSFORM LIVES Everything we do is designed to improve the quality of life of the people in the state of Illinois, across the nation, and around the world. We discover, develop, translate, and disseminate knowledge to address societal concerns and train the next generation of experts and leaders in a way that empowers them to expand the boundaries of science to higher levels of understanding and influence.
Be a part of our story. The Department of Food Science and Human Nutrition (FSHN) at the University of Illinois seeks to fill a position for an Assistant Professor of Food and Nutrition Security. This position is part of an initiative at the College of Agricultural, Consumer and Environmental Sciences to contribute to the improvement of global human and environmental health via the food system. We intend to dramatically strengthen and expand our capacity in this arena through a seven-position cluster hire focused on Food and Agricultural Systems for Global Health. Faculty hired into these positions will lead college-wide efforts in food security and global health and participate in related campus priorities, including the Nutrition and Food Security theme of the campus strategic plan (https://blogs.illinois.edu/view/7831/601847 ), the Interdisciplinary Health Sciences Institute, Illinois Extension, Carle-Illinois College of Medicine and Carl R. Woese Institute for Genomic Biology, among others.
The Department of Food Science and Human Nutrition (FSHN) seeks an outstanding scholar who uses community nutrition, food & nutrition policy, public health and/or related approaches to alleviate consequences of food and nutrition insecurity on health and quality of life. We seek a scholar whose work impacts advancing social equity at the regional, national, and/or international level.
The selected candidate is expected to develop an integrated research-teaching program that addresses the nutritional consequences of food insecurity as broadly defined. Potential research topics may include, but are not limited to, developing community or population health interventions to address food and nutrition insecurity, addressing social determinants of health and other barriers to health equity, and prevention or treatment of noncommunicable diseases that are prevalent in food insecure populations. Researchers targeting populations at risk for nutrition insecurity, such as early childhood, elderly/healthy aging, and rural populations are also encouraged to apply. Research to advance the measurement of nutrition security or malnutrition (self-reported, biomarkers, clinical assessment, or via technological innovation) are also of interest.
Responsibilities: The successful candidate will establish and maintain an externally funded and independent research program focused on the nutritional consequences and/or intervention of food and nutrition insecurity. Key discoveries will be translated into national and global health practices and food and nutrition policy changes. The successful candidate will teach food science and human nutrition courses relevant to their expertise at the undergraduate and graduate levels. This position will involve research, teaching, and Extension.
Required Qualifications: Candidates must have an earned doctorate in applied nutrition or closely related disciplines including but not limited to public health, epidemiology, community health, food science, and biochemistry. Evidence of professional promise and excellent interpersonal and communication skills are required. Expertise in food and nutrition security as it relates to nutrition and health outcomes is required. The ability to collaborate with diverse audiences and contribute to advancing the diversity, equity, and inclusion of the department and the University is required.
Preferred Qualifications: Postdoctoral training or equivalent professional experience; cross-training in relevant areas; ability to secure extramural funding; a strong publication record; ability to mentor students; experience in college-level teaching; and engagement in professional associations. Registered dietitian nutritionists (RDN) are encouraged to apply.
Appointment Details: 100% full-time 9-month (academic year) tenure-track faculty position at the Assistant Professor level with a 20% Extension appointment.
Proposed Start Date and Location: August 16, 2023; University of Illinois at Urbana Champaign.
Application Process: To ensure full consideration, applications must be received by January 16, 2023. Applicants may be interviewed before January 16, 2023; however, no hiring decision will be made until after that date. This position will remain open until a suitable candidate is identified and the position is filled. Individuals with diverse, underrepresented backgrounds are especially welcome to apply.
Interested applicants must submit: A cover letter that details suitability for and interest in the position Curriculum vitae Statement of previous research accomplishments and future research vision (2 pages or less) Statement of teaching philosophy (2 pages or less) Statement on commitment to diversity, equity and inclusion (2 pages or less) * Names and contact information for five (5) references.
Apply for this position using the Apply Now button at the top or bottom of this posting. Applications not submitted through https://jobs.illinois.edu or incomplete applications will not be considered. Upload all materials in a single PDF file in the “CV/Resume” section.
*Diversity, equity, inclusion, and belonging are core values at the University of Illinois Urbana-Champaign and the Department of Food Science and Human Nutrition. Successful candidates for our faculty positions will demonstrate a commitment to advancing these objectives and values. All applicants are required to submit a statement on diversity, equity, and inclusion, which will be evaluated on the applicant's knowledge, record, and future contributions in this area. The Diversity Statement describes: your experience engaging with students of diverse backgrounds (e.g., students from underrepresented groups, first-generation college students, etc.) and/or fostering diverse perspectives; what diversity, equity, and inclusion mean to you and how that is incorporated in your teaching, research and/or service; and how you would approach creating an inclusive learning environment in the classroom, laboratory and/or broader university community.
The University of Illinois conducts criminal background checks on all job candidates upon acceptance of a contingent offer. Final approval is given by the Board of Trustees of the University of Illinois.
Additional Information: For additional information about the department see https://fshn.illinois.edu/; For information about the position contact the search chair, Dr. Michael Miller, Professor, mille216@illinois.edu; For questions regarding the search process may be directed to Ms. Audra Martin, Office Manager, mart@illinois.edu; For questions regarding the application process, please contact 217-333-2137.
The University of Illinois System is an equal opportunity employer, including but not limited to disability and/or veteran status, and complies with all applicable state and federal employment mandates. Please visit Required Employment Notices and Posters to view our non-discrimination statement and find additional information about required background checks, sexual harassment/misconduct disclosures, COVID-19 vaccination requirement, and employment eligibility review through E-Verify.
As an equal opportunity employer, all qualified applicants will receive consideration for employment without regard to race, religion, color, national origin, sex, sexual orientation, gender identity, age, status as a protected veteran, or status as a qualified individual with a disability. Illinois welcomes individuals with diverse backgrounds, experiences, and ideas who embrace and value diversity and inclusivity www.inclusiveillinois.illinois.edu.
Applicants with disabilities are encouraged to apply and may request a reasonable accommodation under the Americans with Disabilities Act (2008) to complete the application and/or interview process. Requests may be submitted through the reasonable accommodations portal, or by contacting the Accessibility & Accommodations Division of the Office for Access and Equity at 217-333-0885, or by emailing accessibility@illinois.edu.
",Faculty Positions,,,,,,,,,,,,
