Job ID,Job Title,Job URL,Diversity Job,Employer,Location,Salary,Date Posted,Description,Position Type 0.0,Position Type 0.1,Position Type 0.2,Position Type 0.3,Position Type 0.4,Position Type 0.5,Position Type 0.6,Position Type 0.7,Position Type 0.8,Position Type 0.9,Position Type 1.0,Position Type 1.1,Position Type 1.2
37378162,"Assistant-Associate Professor, Food Processing",https://jobs.chronicle.com/job/37378162/assistant-associate-professor-food-processing/,False,University of Illinois at Urbana-Champaign,"Urbana, Illinois",Competitive salary with benefits and start-up package are commensurate with qualifications.,2022-12-14,"Apply at:
https://go.fshn.illinois.edu/FoodProcessing
WE TRANSFORM LIVES
Everything we do is designed to improve the quality of life of the people in the state of Illinois, across the nation, and around the world. We discover, develop, translate, and disseminate knowledge to address societal concerns and train the next generation of experts and leaders in a way that empowers them to expand the boundaries of science to higher levels of understanding and influence.
Be a part of our story. The Department of Food Science and Human Nutrition (FSHN) at the University of Illinois at Urbana-Champaign seeks an outstanding expert in food processing with data science focus including AI to fill a full-time 9-month (academic year) tenure-track faculty position at the Assistant/Associate Professor level. The successful candidate will contribute to the FSHN Department’s core areas of food materials science and engineering, food security and safety, and integrated food, nutrition, and health. The selected candidate is expected to develop an integrated program that employs tools of data science to analyze large amounts of data related to food quality and food safety as related to an integrated, sustainable food system. Expertise is desired in food processing and food engineering as related to the application of advanced data science methodologies for food processing, food safety, food product development, entrepreneurship, storage, transportation, or waste mitigation. The candidate will also teach core food processing courses and develop new undergraduate/graduate courses on relevant topics.
This position is synergistic with the campus priority area of Food Security & Safety within the Energy & Environment theme. Within FSHN, this position fits the emphasis areas of Food Safety & Security and Food Materials Science & Engineering. This position is aligned with several campus initiatives such as the Institute for Sustainability, Energy, and Environment, the newly emerging Siebel Center for Design, and the ADM Institute for the Prevention of Postharvest Loss. The successful candidate will be well positioned to collaborate with scientists and facilities across campus including in the Integrated Bioprocessing Research Laboratory (IBRL), FSHN Pilot Processing Plant, and the Carl R. Woese Institute for Genomic Biology.
Responsibilities: The successful candidate will establish and maintain an externally funded and independent research program focused on food processing. Emphasis will be on developing advanced data analytics research utilizing tools such as AI to analyze big data related to improving the quality and safety of food products. Through collaborations with other faculty, key discoveries will be translated into recommendations for the food industry to improve the quality and safety of food products and the efficiency of food processes. The successful candidate will teach core food processing courses and other courses relevant to their expertise at the undergraduate and graduate levels and participate in online instruction at the graduate level. This position will involve research, teaching, and outreach obligations, including interaction with the University of Illinois Extension.
Required Qualifications: Candidates must have an earned doctorate in food science, agricultural/biological engineering, or a closely related field with research focused on food processing or bioprocessing. Evidence of professional promise and excellent interpersonal and communication skills are required. Final approval is given by the Board of Trustees of the University of Illinois.
Preferred Qualifications: Cross-training and postdoctoral training in food processing, food engineering, data science; ability to secure extramural funding; a strong publication record; ability to mentor students; experience in college-level teaching; and engagement in professional associations are desired.
Appointment Details: 100% full-time 9-month (academic year) tenure-track faculty position at the Assistant Professor level.
Proposed Start Date and Location: August 16, 2023; University of Illinois at Urbana- Champaign.
Application Process: To ensure full consideration, applications must be received by January 31, 2023. Applicants may be interviewed before January 31, 2023; however, no hiring decision will be made until after that date. This position will remain open until a suitable candidate is identified and the position is filled. Individuals from underrepresented populations are especially welcome to apply.
Interested applicants must submit: 1. cover letter that details suitability 2. curriculum vitae 3. statement of previous research accomplishments and future research vision (2-page limit)* 4. statement of teaching philosophy (2-page limit) 5. statement on commitment to diversity, equity and inclusion (1-page limit)** 6. copies of two representative publications 7. names and contact information of 3 references (no letters).
Apply for this position using the Apply Now button at the top or bottom of this posting. Applications not submitted through https://jobs.illinois.edu or incomplete applications will not be considered. Upload all materials in a single PDF file in the “CV/Resume” section.
*The research statement should address the broad societal justification for your research program, the impact of your previous research accomplishments, and your vision for future research including main research questions, approaches, and paths to funding. The teaching statement should address your primary goals in teaching, why they are important to you, and what methods you have or intend to use to accomplish those goals. The statement on diversity should address past and/or potential contributions to diversity, equity, and inclusion through research, teaching, and/or service. For further guidance, we suggest the applicant refer to Illinois’s Provost Communication #9: Promotion and Tenure and ‘Instructions for Preparing Promotion Dossiers: Candidate Statements: A, B & D’ for information on these three statements.
**Diversity, equity, inclusion, and belonging are core values at the University of Illinois Urbana-Champaign and the Department of Food Science and Human Nutrition. Successful candidates for our faculty positions will demonstrate a commitment to advancing these objectives and values. All applicants are required to submit a statement on diversity, equity, and inclusion, which will be evaluated on the applicant's knowledge, record, and future contributions in this area. The Diversity Statement describes: your experience engaging with students of diverse backgrounds (e.g., students from underrepresented groups, first-generation college students, etc.) and/or fostering diverse perspectives; what diversity, equity, and inclusion mean to you and how that is incorporated in your teaching, research and/or service; and how you would approach creating an inclusive learning environment in the classroom, laboratory and/or broader university community.
The University of Illinois conducts criminal background checks on all job candidates upon acceptance of a contingent offer. Final approval is given by the Board of Trustees of the University of Illinois.
Additional Information: For additional information about the department see https://fshn.illinois.edu/; For information about the position contact the search chair, Dr. Pratik Banerjee, Associate Professor, pratik@illinois.edu; For questions regarding the search process may be directed to Ms. Audra Martin, Office Manager, mart@illinois.edu; For questions regarding the application process, please contact 217-333-2137.
The University of Illinois System is an equal opportunity employer, including but not limited to disability and/or veteran status, and complies with all applicable state and federal employment mandates. Please visit Required Employment Notices and Posters to view our non-discrimination statement and find additional information about required background checks, sexual harassment/misconduct disclosures, COVID-19 vaccination requirement, and employment eligibility review through E-Verify.
As an equal opportunity employer, all qualified applicants will receive consideration for employment without regard to race, religion, color, national origin, sex, sexual orientation, gender identity, age, status as a protected veteran, or status as a qualified individual with a disability. Illinois welcomes individuals with diverse backgrounds, experiences, and ideas who embrace and value diversity and inclusivity. www.inclusiveillinois.illinois.edu.
Applicants with disabilities are encouraged to apply and may request a reasonable accommodation under the Americans with Disabilities Act (2008) to complete the application and/or interview process. Requests may be submitted through the reasonable accommodations portal, or by contacting the Accessibility & Accommodations Division of the Office for Access and Equity at 217-333-0885, or by emailing accessibility@illinois.edu.
",Faculty Positions,,,,,,,,,,,,
37378161,"Assistant Professor, Music",https://jobs.chronicle.com/job/37378161/assistant-professor-music/,False,Saint Mary's College,"Notre Dame, Indiana",Not Specified,2022-12-14,"POSITION
Full-time, tenure-track appointment in the Department of Music.
 
DESCRIPTION
The department seeks a committed, enthusiastic, active faculty member to support our music curriculum and lead our Bachelor of Music Education degree program. An instrumentalist is preferred to prepare future educators for teaching music in the elementary and secondary schools in today’s environment. This position does not include leadership of a performing ensemble. The faculty member will use innovative and inclusive pedagogy to teach courses in elementary and secondary music methods and at least two of the following: woodwind techniques, brass techniques, string techniques, percussion techniques. They will work with the Education Department to coordinate the student teaching experience in Music. In addition, the faculty member must have an interest in and ability to teach in one or more secondary areas that support the Bachelor of Arts degree in music. These can include music theory, digital media in music, global music, popular music, music history/appreciation or other areas depending on the candidate’s interest and experience. The faculty member will be expected to participate fully in departmental and college activities. Creative work and/or research and publication required. The department is excited to welcome a colleague to support the building and maintenance of productive relationships with area music educators. Strong recruiting skills are desired.
 
APPOINTMENT
The position will begin in August 2023.
 
QUALIFICATIONS
Doctorate in Music Education preferred; ABD considered. Elementary/Secondary teaching experience required.
 
DEPARTMENT
The Department of Music, an accredited institutional member of the National Association of Schools of Music, has an energetic faculty of artists that works closely together, providing studies leading to the B.M. in Music Education, and the B.A. in Music. There are extensive on-campus performance activities for music majors as well as the general student. Housed in the Moreau Center for the Arts, the department’s facilities include computer and piano labs, excellent practice facilities, the Little Theatre recital hall and the 1,300-seat O’Laughlin Auditorium. 
 
COLLEGE
Saint Mary’s is a competitive, private undergraduate Catholic women’s college with an emphasis on quality teaching and student-faculty research collaborations. Saint Mary’s College is located in Notre Dame, IN and is adjacent to South Bend, an ethnically diverse city of 120,000 people, in Northern Indiana, approximately 90 miles east of Chicago. Saint Mary’s College and the University of Notre Dame, within walking distance of each other, enjoy the academic and cultural advantages of a co-exchange program.
Saint Mary’s College has a mission-driven responsibility to be diverse, inclusive, and equitable. Saint Mary’s College is an Equal Opportunity Employer. In keeping with the College’s mission, Saint Mary’s is committed to increasing its diversity at all levels--students, faculty, and staff-- and seeks applications from candidates who share this commitment.
 
APPLICATION
Review of candidates will begin January 23. A complete application should include:

A letter of interest with a description of your experience in the field of Music Education and a discussion of how you could support the wider Music program
A statement of your understanding of the importance of diversity, equity, inclusion, and justice in academia, with evidence of your current contributions and plans for advancing that work at Saint Mary’s College
A curriculum vitae, complete transcripts, and contact information for 3 references

Email all materials to Dr. Nancy Menk, Chair, Department of Music at SMCMusicPositions@gmail.com.
 
Saint Mary’s College is an Equal Opportunity Employer. In keeping with the College’s mission, Saint Mary’s is committed to increasing its diversity at all levels—students, faculty, and staff—and seeks applications from candidates who share this commitment.
",Faculty Positions,Arts,Music,Education,,,,,,,,,
37378126,Tenured/Tenure-Track: Open Rank,https://jobs.chronicle.com/job/37378126/tenured-tenure-track-open-rank/?LinkSource=PremiumListing,False,Harold Vance Department of Petroleum Engineering,"College Station, Texas",Commensurate with Experience,2022-12-14,"The Harold Vance Department of Petroleum Engineering in the College of Engineering at Texas A&M University invites applications for two full-time, tenured or tenure-track position with a 9-month academic appointment, and the possibility of an additional summer appointment contingent upon need and availability of funds, beginning the fall of 2023. The successful applicant(s) is expected to build a nationally recognized, externally funded research program in advanced drilling with application to geothermal energy or multi-scale coupled flow simulation with applications to carbon sequestration and hydrocarbon recovery; teach, advise and mentor graduate students; participate in all aspects of the department’s activities; and serve the profession. Industrial experience in petroleum engineering is an asset, and exceptional candidates in other areas will also be considered.
The Harold Vance Department of Petroleum Engineering at Texas A&M is recognized as one of the top petroleum engineering programs in the U.S. and is well known in the international oil and gas community.  The department has 36 faculty members and over 430 students at its College Station campus. 
Texas A&M University is located in the twin cities of Bryan and College Station, Texas, with a population of more than 273,000 and conveniently centrally located in a triangle formed by Dallas, Houston and Austin. Texas A&M has more than 69,400 graduate and undergraduate students enrolled. Research expenditures total more than $922 million annually, ranking Texas A&M in the top tier of universities nationwide. The Texas A&M University System has an endowment valued at more than $13.6 billion and Texas A&M University ranks 3rd among U.S. public universities and 8th overall. With more than 700 faculty members and over 20,000 students, the College of Engineering is one of the largest engineering schools in the country. The college is ranked 8th in graduate studies and 7th in undergraduate programs among public institutions by U.S. News & World Report, with nine of the college’s 15 departments ranked in the Top 10. The college is also ranked 3rd in research expenditures by the American Society for Engineering Education. Texas A&M is aware that attracting and retaining exceptional faculty often depends on meeting the needs of two careers and having policies that contribute to work-life balance.
",Faculty Positions,,,,,,,,,,,,
37378126,Tenured/Tenure-Track: Open Rank,https://jobs.chronicle.com/job/37378126/tenured-tenure-track-open-rank/?LinkSource=PremiumListing,False,Harold Vance Department of Petroleum Engineering,"College Station, Texas",Commensurate with Experience,2022-12-14,"The Harold Vance Department of Petroleum Engineering in the College of Engineering at Texas A&M University invites applications for two full-time, tenured or tenure-track position with a 9-month academic appointment, and the possibility of an additional summer appointment contingent upon need and availability of funds, beginning the fall of 2023. The successful applicant(s) is expected to build a nationally recognized, externally funded research program in advanced drilling with application to geothermal energy or multi-scale coupled flow simulation with applications to carbon sequestration and hydrocarbon recovery; teach, advise and mentor graduate students; participate in all aspects of the department’s activities; and serve the profession. Industrial experience in petroleum engineering is an asset, and exceptional candidates in other areas will also be considered.
The Harold Vance Department of Petroleum Engineering at Texas A&M is recognized as one of the top petroleum engineering programs in the U.S. and is well known in the international oil and gas community.  The department has 36 faculty members and over 430 students at its College Station campus. 
Texas A&M University is located in the twin cities of Bryan and College Station, Texas, with a population of more than 273,000 and conveniently centrally located in a triangle formed by Dallas, Houston and Austin. Texas A&M has more than 69,400 graduate and undergraduate students enrolled. Research expenditures total more than $922 million annually, ranking Texas A&M in the top tier of universities nationwide. The Texas A&M University System has an endowment valued at more than $13.6 billion and Texas A&M University ranks 3rd among U.S. public universities and 8th overall. With more than 700 faculty members and over 20,000 students, the College of Engineering is one of the largest engineering schools in the country. The college is ranked 8th in graduate studies and 7th in undergraduate programs among public institutions by U.S. News & World Report, with nine of the college’s 15 departments ranked in the Top 10. The college is also ranked 3rd in research expenditures by the American Society for Engineering Education. Texas A&M is aware that attracting and retaining exceptional faculty often depends on meeting the needs of two careers and having policies that contribute to work-life balance.
",Faculty Positions,,,,,,,,,,,,
37378126,Tenured/Tenure-Track: Open Rank,https://jobs.chronicle.com/job/37378126/tenured-tenure-track-open-rank/?LinkSource=TopJob,True,Harold Vance Department of Petroleum Engineering,"College Station, Texas",Commensurate with Experience,2022-12-14,"The Harold Vance Department of Petroleum Engineering in the College of Engineering at Texas A&M University invites applications for two full-time, tenured or tenure-track position with a 9-month academic appointment, and the possibility of an additional summer appointment contingent upon need and availability of funds, beginning the fall of 2023. The successful applicant(s) is expected to build a nationally recognized, externally funded research program in advanced drilling with application to geothermal energy or multi-scale coupled flow simulation with applications to carbon sequestration and hydrocarbon recovery; teach, advise and mentor graduate students; participate in all aspects of the department’s activities; and serve the profession. Industrial experience in petroleum engineering is an asset, and exceptional candidates in other areas will also be considered.
The Harold Vance Department of Petroleum Engineering at Texas A&M is recognized as one of the top petroleum engineering programs in the U.S. and is well known in the international oil and gas community.  The department has 36 faculty members and over 430 students at its College Station campus. 
Texas A&M University is located in the twin cities of Bryan and College Station, Texas, with a population of more than 273,000 and conveniently centrally located in a triangle formed by Dallas, Houston and Austin. Texas A&M has more than 69,400 graduate and undergraduate students enrolled. Research expenditures total more than $922 million annually, ranking Texas A&M in the top tier of universities nationwide. The Texas A&M University System has an endowment valued at more than $13.6 billion and Texas A&M University ranks 3rd among U.S. public universities and 8th overall. With more than 700 faculty members and over 20,000 students, the College of Engineering is one of the largest engineering schools in the country. The college is ranked 8th in graduate studies and 7th in undergraduate programs among public institutions by U.S. News & World Report, with nine of the college’s 15 departments ranked in the Top 10. The college is also ranked 3rd in research expenditures by the American Society for Engineering Education. Texas A&M is aware that attracting and retaining exceptional faculty often depends on meeting the needs of two careers and having policies that contribute to work-life balance.
",Faculty Positions,,,,,,,,,,,,
37378126,Tenured/Tenure-Track: Open Rank,https://jobs.chronicle.com/job/37378126/tenured-tenure-track-open-rank/?LinkSource=TopJob,True,Harold Vance Department of Petroleum Engineering,"College Station, Texas",Commensurate with Experience,2022-12-14,"The Harold Vance Department of Petroleum Engineering in the College of Engineering at Texas A&M University invites applications for two full-time, tenured or tenure-track position with a 9-month academic appointment, and the possibility of an additional summer appointment contingent upon need and availability of funds, beginning the fall of 2023. The successful applicant(s) is expected to build a nationally recognized, externally funded research program in advanced drilling with application to geothermal energy or multi-scale coupled flow simulation with applications to carbon sequestration and hydrocarbon recovery; teach, advise and mentor graduate students; participate in all aspects of the department’s activities; and serve the profession. Industrial experience in petroleum engineering is an asset, and exceptional candidates in other areas will also be considered.
The Harold Vance Department of Petroleum Engineering at Texas A&M is recognized as one of the top petroleum engineering programs in the U.S. and is well known in the international oil and gas community.  The department has 36 faculty members and over 430 students at its College Station campus. 
Texas A&M University is located in the twin cities of Bryan and College Station, Texas, with a population of more than 273,000 and conveniently centrally located in a triangle formed by Dallas, Houston and Austin. Texas A&M has more than 69,400 graduate and undergraduate students enrolled. Research expenditures total more than $922 million annually, ranking Texas A&M in the top tier of universities nationwide. The Texas A&M University System has an endowment valued at more than $13.6 billion and Texas A&M University ranks 3rd among U.S. public universities and 8th overall. With more than 700 faculty members and over 20,000 students, the College of Engineering is one of the largest engineering schools in the country. The college is ranked 8th in graduate studies and 7th in undergraduate programs among public institutions by U.S. News & World Report, with nine of the college’s 15 departments ranked in the Top 10. The college is also ranked 3rd in research expenditures by the American Society for Engineering Education. Texas A&M is aware that attracting and retaining exceptional faculty often depends on meeting the needs of two careers and having policies that contribute to work-life balance.
",Faculty Positions,,,,,,,,,,,,
