Job ID,Job Title,Job URL,Diversity Job,Employer,Location,Salary,Date Posted,Description,Position Type 0.0,Position Type 0.1,Position Type 0.2,Position Type 0.3,Position Type 0.4,Position Type 0.5,Position Type 0.6,Position Type 0.7,Position Type 0.8,Position Type 0.9,Position Type 1.0,Position Type 1.1,Position Type 1.2
37377649,Assistant Professor (Tenure-Track) Theatre Stage Management (23-24),https://jobs.chronicle.com/job/37377649/assistant-professor-tenure-track-theatre-stage-management-23-24-/,False,DePaul University,"Illinois, United States",Salary Not Specified,2022-12-14,"Description
Assistant/Associate Tenure Track Faculty Position and
Head of BFA Program in Stage Management. The Theatre
School at DePaul University invites applications for a full-time
tenure-track professor to serve as head of its renowned BFA Stage
Management program. The Theatre School is an urban multicultural
conservatory located in the heart of Chicago's vibrant theatre
community. The ideal candidate will be collegial, a visionary, a
leader, an accomplished professional, and a great teacher. 
Position begins September of 2023. 
The Theatre School at DePaul University
educates, trains, and inspires students of theatre in a
conservatory setting that is rigorous, disciplined, culturally
diverse, and that strives for the highest level of professional
skill and artistry.  Central to our mission is a commitment to
diversity, inclusion, equity, and equality in education.  As an
integral part of the training, The Theatre School produces public
programs and performances of a wide repertoire of plays-classic,
contemporary, and original-that challenge, entertain, and stimulate
the imaginations of our artists and audiences.  We seek to enhance
the intellectual and cultural life of our university, our city, and
the profession. 
The BFA Program in Stage
Management welcomes 4-5 students a year to a
four-year curriculum that simulates a stage manager's professional
experience and process. Students learn to communicate with and
manage all areas of production. Students collaborate with
directors, designers, actors, administration, and our professional
staff as part of our production program.  
DePaul University is a thriving multi-faceted
Catholic, Vincentian, and urban university with ten colleges, seven
campuses, and enrollment of over 20,000 students.  The Theatre
School, located on the university’s Lincoln Park campus two miles
north of the Chicago Loop, enrolls 400 students in 15 undergraduate
and 3 graduate programs.  Our faculty (30 full-time and 60+
part-time) includes leading Chicago theatre artists across all
disciplines.  Faculty members are active participants in the
vibrant Chicago theatre community. 
Qualifications
Candidates for consideration will possess the following
qualifications: 


Evidence of teaching experience that can translate to
undergraduate training; 


Demonstrated success with mentoring talent at early stages of
professional artistic development 


A current, ongoing, and recognized theatrical practice of at
least 5 years; 


Demonstrated expertise in a variety of live event
management 


Evidence of a multi-cultural perspective in candidate’s body of
work, including working with diverse populations 




A commitment to continued work in the profession; 


Professional experience equivalent to and/or a terminal degree
in Stage Management or related fields 


A working knowledge of theatrical union agreements and
practices 


Demonstrated commitment to developing personal practice, craft,
and artistry 


Evidence of unwavering commitment to collegiality and
collaboration 




Ability to expand the existing expertise and competencies of the
current faculty 


Clear and human-centered communication skills 


A commitment to imagining the theatre of the future and making
it happen 


Proficiency in current industry-related technologies; 


Because the school seeks faculty members who bring a critical
perspective to issues of diversity and multiculturalism, DePaul
University offers equal employment opportunities to all persons
without regard to race, color, ethnicity, religion, gender, sexual
orientation, national origin, age, marital status, physical or
mental disability, parental status, housing status, source of
income, or military status in accordance with applicable federal,
state, and local EEO laws. Salary is commensurate with
qualifications and experience. 
Responsibilities (may include, but are not limited
to):  


BFA Stage Management Program leadership; 


Teaching all levels of undergraduate stage management
students; 




Advising students on academic progress; 


Mentoring and advising on student production work; 


Commitment to on-going evaluation of the stage management
program; 


Commitment to world-class stage management training; 


Recruitment of new students; 




Internship coordination and supervision; 


Hiring and supervision of adjunct instructors; 


Fostering relationships with alumni, as well as national/local
theatres to establish internships and other collaborative
opportunities for students; 


Participate in school, university, and community
service; 


Ongoing demonstration of professional activities; 




Stay current with accepted industry protocols and
standards. 


Application Instructions
Applications are only being accepted via Interfolio. Required
materials include a cover letter, most recent CV, and Teaching
Statement. As part of your cover letter, please address how your
current work, including creative activities, teaching and service
would advance the Theatre School’s commitment to promoting access,
equity and inclusion for all individuals.
Include a list of three references. Please note that letters of
recommendation will be requested later in the process.
Applications are only being accepted via
Interfolio  http://apply.interfolio.com/109686
Applications should be submitted by midnight on
January 15, 2023.  
 
Equal Employment Opportunity Statement
DePaul University is an Equal Opportunity / Affirmative Action
employer.  All qualified applicants will receive consideration
for employment without regard to race, color, ethnicity, religion,
sex, sexual orientation, gender identity, national origin, age,
martial status, physical or mental disability, protected veteran
status, genetic information or any other legally protected status,
in accordance with applicable federal, state and local EEO
laws.
Safety and Security Statement - Clery Act:
A copy of DePaul University's Safety and Security Information
Report and Fire Safety Report is available upon request.  The
report includes statistics about crimes that occurred on campus and
public property immediately adjacent to campus.  The report
includes institutional policies concerning campus security, sexual
assault and other matters.  It also includes fire statistics,
fire safety practices and standards of the institution.  A
copy of this report can be obtained by contacting the Crime
Prevention Office at 773-325-7775 or by visiting the DePaul Public
Safety website at http://publicsafety.depaul.edu .
Title IX Statement:
Federal Title IX policy requires that all colleges and
universities make known the contact information for the person
responsible for coordinating its efforts to comply with Title IX
responsibilities.  At DePaul University, the Title IX
Coordinator is Kathryn Statz.  Her office is located in
Lincoln Park on the 3rd floor of the Student Center, 2250 N.
Sheffield Avenue.  She can be reached at 312-362-8970,
or titleixcoordinator@depaul.edu.
Required COVID-19 Vaccination:
Employment at DePaul University is contingent upon
receiving all recommended doses of the COVID-19 vaccine
including the booster or having a valid religious or medical
reason not to be vaccinated.  To request a
medical or religious exemption, please email employeerelations@depaul.edu
Required Background Check:
Employment at DePaul University is contingent on passing a
background check.  Only final candidates who are extended an
offer of employment will undergo a background check. 
Mandated Reporting of Child Abuse &
Neglect:
Upon accepting an offer of employment with the university,
you will also be required to sign an Acknowledgement of Mandated
Reporter Status at the time of hire.  A mandated reporter
is required to make a report to the Illinois DCFS Hotline
whenever there is a reasonable cause to believe that a
child known to them in their professional or official
capacity may be abused or neglected.  For more information,
please visit the following pages:  

Illinois Department of Children & Family Services
(DCFS)

Illinois Abused and Neglected Child Reporting Act
",Faculty Positions,Arts,Other Arts,Performing Arts,,,,,,,,,
37377648,: Assistant Professor (Tenure Track) Costume Technology (23-24),https://jobs.chronicle.com/job/37377648/-assistant-professor-tenure-track-costume-technology-23-24-/,False,DePaul University,"Illinois, United States",Salary Not Specified,2022-12-14,"Description
The Theatre School at DePaul University invites applications for
an Assistant Professor, tenure‐track faculty to serve as head of
its Costume Technology program. The Theatre School is an urban
multicultural conservatory located in the heart of Chicago's
vibrant theatre community. The ideal candidate will be a great
teacher, accomplished professional, strong collaborator, visionary
technician, and a proactive leader. The position begins September
of 2023.
Qualifications
Candidates for consideration will possess the following
qualifications:

Experience in teaching, mentoring, advising, and/or supervising
young people.
Demonstrated cultural competency and commitment to equitable
practices that allow for inclusive and diverse educational
experiences.
Evidence of a diverse, professional production and/or client
portfolio.
Demonstrated commitment to ongoing anti‐racism practices.
Extensive knowledge of costume technology, including
patterning, costume construction, and costume crafts.
Knowledge of maker technologies such as Cricut machine, laser
cutters, CNC machine, digital fabric printing, digital patterning,
and interest in incorporating them into the costume technology
curriculum.
Experience in patterning and garment construction for diverse
body types and fostering an inclusive and affirming collaborative
environment.
Ability to support students across the gender spectrum.
Extensive experience collaborating with Costume Designers at
all experience levels.
Experience with a variety of dramatic forms and venues or
media.
Professional experience equivalent to and/or a terminal degree
in Costume Technology or related fields.
Demonstrated commitment to a just theatre community and
personal collaboration.

The Theatre School has a strong desire to increase the diversity
of our faculty. We seek applicants who reflect the diversity of our
student body and the city of Chicago. Those with experience working
with diverse faculty, staff, and students, and who can contribute
to an inclusive climate are encouraged to apply. We urge candidates
to provide examples of their successes in these areas. We
especially encourage applications from members of historically
underrepresented groups, including members of the global majority,
the LGTBQ community, and persons with disabilities. For more
information, please see The Theatre School's Commitment to
Anti‐Racism.
Because the school seeks faculty members who bring a critical
perspective to issues of diversity and multiculturalism, DePaul
University offers equal employment opportunities to all persons
without regard to race, color, ethnicity, religion, gender, sexual
orientation, national origin, age, marital status, physical or
mental disability, parental status, housing status, source of
income, or military status in accordance with applicable federal,
state, and local EEO laws. Salary is commensurate with
qualifications and experience.
Responsibilities (may include, but are not limited
to):  

Lead and further develop the BFA Costume Technology
Program  
Teach a range of courses across the Costume Technology Program
according to the candidate’s expertise.
Prepare students for diverse and multicultural work
environments.
Collaborate with Costume Shop manager and staff to maintain the
studio and supply needs.
Advise students on academic progress.
Mentor and advise on student production work and
internships.
Recruit new students and develop enrollment.
Hire and collaborate with adjunct instructors

Application Instructions
Application and deadlines: Please apply
online and include:

cover letter
personal narrative
teaching philosophy
CV/resume
list of three references
a select sampling of your professional portfolio (via a digital
file or website link).  

All applicants must apply online to be considered. Paper
applications will not be accepted. Letters of recommendation and a
full portfolio will be requested at a later stage of the search
process.  The application closes at midnight on
January 4, 2023. 
Equal Employment Opportunity Statement
DePaul University is an Equal Opportunity / Affirmative Action
employer.  All qualified applicants will receive consideration
for employment without regard to race, color, ethnicity, religion,
sex, sexual orientation, gender identity, national origin, age,
martial status, physical or mental disability, protected veteran
status, genetic information or any other legally protected status,
in accordance with applicable federal, state and local EEO
laws.
Safety and Security Statement - Clery Act:
A copy of DePaul University's Safety and Security Information
Report and Fire Safety Report is available upon request.  The
report includes statistics about crimes that occurred on campus and
public property immediately adjacent to campus.  The report
includes institutional policies concerning campus security, sexual
assault and other matters.  It also includes fire statistics,
fire safety practices and standards of the institution.  A
copy of this report can be obtained by contacting the Crime
Prevention Office at 773-325-7775 or by visiting the DePaul Public
Safety website at http://publicsafety.depaul.edu .
Title IX Statement:
Federal Title IX policy requires that all colleges and
universities make known the contact information for the person
responsible for coordinating its efforts to comply with Title IX
responsibilities.  At DePaul University, the Title IX
Coordinator is Kathryn Statz.  Her office is located in
Lincoln Park on the 3rd floor of the Student Center, 2250 N.
Sheffield Avenue.  She can be reached at 312-362-8970,
or titleixcoordinator@depaul.edu.
Required COVID-19 Vaccination:
Employment at DePaul University is contingent upon
receiving all recommended doses of the COVID-19 vaccine
including the booster or having a valid religious or medical
reason not to be vaccinated.  To request a
medical or religious exemption, please email employeerelations@depaul.edu
Required Background Check:
Employment at DePaul University is contingent on passing a
background check.  Only final candidates who are extended an
offer of employment will undergo a background check. 
Mandated Reporting of Child Abuse &
Neglect:
Upon accepting an offer of employment with the university,
you will also be required to sign an Acknowledgement of Mandated
Reporter Status at the time of hire.  A mandated reporter
is required to make a report to the Illinois DCFS Hotline
whenever there is a reasonable cause to believe that a
child known to them in their professional or official
capacity may be abused or neglected.  For more information,
please visit the following pages:  

Illinois Department of Children & Family Services
(DCFS)

Illinois Abused and Neglected Child Reporting Act
",Faculty Positions,Arts,Other Arts,Performing Arts,,,,,,,,,
37377646,Assistant Professor in Production Design Production (23-24),https://jobs.chronicle.com/job/37377646/assistant-professor-in-production-design-production-23-24-/,False,DePaul University,"Illinois, United States",Salary Not Specified,2022-12-14,"Description
DePaul University is located in the heart of Chicago's vibrant
Loop and Lincoln Park communities. In 2022, DePaul’s School of
Cinematic Arts (SCA) was ranked 15th in Hollywood
Reporter’s annual list of the top film schools in the
country and named by Variety as one of the top
film schools in the world. 
 
There are currently over 1,700 majors enrolled in School of
Cinematic Arts BA, BFA, MA, MS, and MFA degree programs. Production
Design is one of eleven concentrations in the Film and Television
BFA degree.  SCA also offers MFA degrees in Film and
Television, Animation, Creative Producing, Directing, Documentary,
and Screenwriting. Production resources include four full sound
stages and a production facility at Chicago’s world-class Cinespace
Studios, two green screen stages, production studios for
television, film, and sound, virtual production facilities,
industry standard camera packages, and a 4K digital cinema theater.
For more information about SCA programs, please visit our
website: http://www.cdm.depaul.edu/about/Pages/School-of-Cinematic-Arts.aspx
 
Responsibilities
The School of Cinematic Arts at DePaul University invites
applicants for a full-time, tenure-track Assistant Professor
position in Production Design. The responsibilities of this
position will require teaching undergraduate and graduate courses
in production design for film and television. The successful
candidate will be instrumental in helping SCA strengthen its
Production Design concentration, including exploring new ways to
collaborate and coordinate with the Scene Design program in
DePaul's Theater School. 
 
The ability to teach other courses in film and television
production is also desired.
 
All tenure-track faculty are expected to develop and maintain a
scholarly profile that aligns with the expectations of tenure and
promotion. Additionally, they participate in service within and
beyond campus including attendance at program and school meetings,
active participation in recruitment efforts, advising students,
participation in school, college, and university committees, and
professional stewardship in the field.
Qualifications
Record of professional practice and/or creative activity is
required. Successful applicants will be able to teach theoretical
and practical hands-on courses, will have industry and/or academic
experience, and are motivated to work with faculty and students on
building curriculum, leading school-wide initiatives, and/or
participating in collaborative projects. We are actively seeking
candidates with cultural diversity competency skills that enhance
the experience of traditionally excluded populations and cultivate
a more inclusive climate for our students, staff, faculty, and the
broader community of which DePaul is an integral part.
 
Minimum Qualifications

MFA degree OR equivalent industry experience in production
design
Exemplary communication and collaboration skills
Able to demonstrate cultural competencies in diverse learning
communities

Application Instructions
Application Deadline
For priority consideration, apply by Jan. 9th, 2023.
Applications will continue to be accepted until the position is
filled.
 
Required Documents

Curriculum vitae
Cover Letter
Links to Creative Work
Contact information for three professional references
A statement describing past and proposed efforts to promote
diversity, equity, and inclusion in your teaching and/or creative
work

Equal Employment Opportunity Statement
DePaul University is an Equal Opportunity / Affirmative Action
employer.  All qualified applicants will receive consideration
for employment without regard to race, color, ethnicity, religion,
sex, sexual orientation, gender identity, national origin, age,
martial status, physical or mental disability, protected veteran
status, genetic information or any other legally protected status,
in accordance with applicable federal, state and local EEO
laws.
Safety and Security Statement - Clery Act:
A copy of DePaul University's Safety and Security Information
Report and Fire Safety Report is available upon request.  The
report includes statistics about crimes that occurred on campus and
public property immediately adjacent to campus.  The report
includes institutional policies concerning campus security, sexual
assault and other matters.  It also includes fire statistics,
fire safety practices and standards of the institution.  A
copy of this report can be obtained by contacting the Crime
Prevention Office at 773-325-7775 or by visiting the DePaul Public
Safety website at http://publicsafety.depaul.edu .
Title IX Statement:
Federal Title IX policy requires that all colleges and
universities make known the contact information for the person
responsible for coordinating its efforts to comply with Title IX
responsibilities.  At DePaul University, the Title IX
Coordinator is Kathryn Statz.  Her office is located in
Lincoln Park on the 3rd floor of the Student Center, 2250 N.
Sheffield Avenue.  She can be reached at 312-362-8970,
or titleixcoordinator@depaul.edu.
Required COVID-19 Vaccination:
Employment at DePaul University is contingent upon
receiving all recommended doses of the COVID-19 vaccine
including the booster or having a valid religious or medical
reason not to be vaccinated.  To request a
medical or religious exemption, please email employeerelations@depaul.edu
Required Background Check:
Employment at DePaul University is contingent on passing a
background check.  Only final candidates who are extended an
offer of employment will undergo a background check. 
Mandated Reporting of Child Abuse &
Neglect:
Upon accepting an offer of employment with the university,
you will also be required to sign an Acknowledgement of Mandated
Reporter Status at the time of hire.  A mandated reporter
is required to make a report to the Illinois DCFS Hotline
whenever there is a reasonable cause to believe that a
child known to them in their professional or official
capacity may be abused or neglected.  For more information,
please visit the following pages:  

Illinois Department of Children & Family Services
(DCFS)

Illinois Abused and Neglected Child Reporting Act
",Faculty Positions,Arts,Other Arts,Performing Arts,,,,,,,,,
