Job ID,Job Title,Job URL,Diversity Job,Employer,Location,Salary,Date Posted,Description,Position Type 0.0,Position Type 0.1,Position Type 0.2,Position Type 0.3,Position Type 0.4,Position Type 0.5,Position Type 0.6,Position Type 0.7,Position Type 0.8,Position Type 0.9,Position Type 1.0,Position Type 1.1,Position Type 1.2
37378119,"Assistant Professor, Food Biophysical Chemistry",https://jobs.chronicle.com/job/37378119/assistant-professor-food-biophysical-chemistry/,False,University of Illinois at Urbana-Champaign,"Urbana, Illinois",Competitive salary with benefits and start-up package are commensurate with qualifications.,2022-12-14,"Apply at:
https://go.fshn.illinois.edu/FoodBiophysicalChemistry
WE TRANSFORM LIVES
Everything we do is designed to improve the quality of life of the people in the state of Illinois, across the nation, and around the world. We discover, develop, translate, and disseminate knowledge to address societal concerns and train the next generation of experts and leaders in a way that empowers them to expand the boundaries of science to higher levels of understanding and influence.
Be a part of our story.
The Department of Food Science and Human Nutrition (FSHN) at the University of Illinois at Urbana-Champaign seeks an outstanding expert in food biophysical chemistry to fill a full-time 9-month (academic year) tenure-track faculty position at the Assistant Professor level. The successful candidate will contribute to the FSHN Department’s core area of Food Materials Science and Engineering. The selected candidate is expected to develop an integrated scholarly program that studies food components, properties and interactions, food microstructures, micro-carriers, and nanotechnology for developing novel, nutritious, abundant, and affordable foods. Expertise in one or more of the following Chemistry, Physical Chemistry, Biochemistry, and Analytical Chemistry as apply to foods is desired.
Within FSHN, this position fits the emphasis areas of Food Materials, Manufacturing and Assessment and Food and Nutrition Systems for Safety, Security and Sustainability. This position is aligned with several campus initiatives such as the Institute for Sustainability, Energy, and Environment, the newly emerging Siebel Center for Design, and the ADM Institute for the Prevention of Postharvest Loss. The successful candidate also will be well positioned to collaborate with scientists across campus including in the Carl R. Woese Institute for Genomic Biology, Materials Research Laboratory, Biotechnology Center, Beckman Institute, and the Integrated Bioprocessing Research Laboratory.
Responsibilities:
The successful candidate will establish and maintain an externally funded and
independent research program focused on food biophysical chemistry. Through
collaborations with other faculty, key discoveries will be translated into innovative
strategies/technologies for application by food manufacturers to address key issues in
the food production and distribution system. The successful candidate will teach core
food chemistry courses relevant to their expertise at the undergraduate and graduate
levels and participate in online instruction at the graduate level. This position will involve
research, teaching, and service obligations. A strong commitment to diversity, equity
and inclusion in this position is essential.
Required Qualifications:
Candidates must have an earned doctorate in food science or directly related discipline
with emphasis on one or more of the following Chemistry, Physical Chemistry,
Biochemistry, and Analytical Chemistry. Evidence of professional promise and excellent
interpersonal and communication skills are required. Final approval is given by the
Board of Trustees of the University of Illinois.
Preferred Qualifications:
Postdoctoral training and/or professional experience in physicochemical properties of
foods, food stability; ability to secure extramural funding; a strong publication record;
ability to mentor students; experience in college-level teaching; and engagement in
professional associations are desired.
Appointment Details:
100% full-time 9-month (academic year) tenure-track faculty position at the Assistant Professor level
Proposed Start Date and Location:
August 16, 2023; University of Illinois at Urbana Champaign.
Application Process:
To ensure full consideration, applications must be received by January 20, 2023.
Applicants may be interviewed before January 20, 2023; however, no hiring decision will
be made until after that date. This position will remain open until a suitable candidate is
identified and the position is filled. Individuals from underrepresented groups are
especially welcome to apply.
Interested applicants must submit:
1. cover letter that details suitability
2. curriculum vitae
3. statement of teaching philosophy and vision
4. statement of previous research accomplishments and future research vision
5. statement on commitment to diversity, equity and inclusion*
6. publications list
7. names and contact information of five references (no letters)
Apply for this position using the Apply Now button at the top or bottom of this posting.
Applications not submitted through https://jobs.illinois.edu or incomplete applications will
not be considered. Upload all materials in a single PDF file in the “CV/Resume” section.
*Diversity, equity, inclusion, and belonging are core values at the University of Illinois
Urbana-Champaign and the Department of Food Science and Human Nutrition.
Successful candidates for our faculty positions will demonstrate a commitment to
advancing these objectives and values. All applicants are required to submit a
statement on diversity, equity, and inclusion, which will be evaluated on the applicant's
knowledge, record, and future contributions in this area. The Diversity Statement
describes: your experience engaging with students of diverse backgrounds (e.g.,
students from underrepresented groups, first-generation college students, etc.) and/or
fostering diverse perspectives; what diversity, equity, and inclusion mean to you and
how that is incorporated in your teaching, research and/or service; and how you would
approach creating an inclusive learning environment in the classroom, laboratory and/or
broader university community.
The University of Illinois conducts criminal background checks on all job candidates
upon acceptance of a contingent offer. Final approval is given by the Board of Trustees
of the University of Illinois.
Additional Information:
For additional information about the department see https://fshn.illinois.edu/;
For information about the position contact the search chair,
Dr. Elvira de Mejia, Professor, edemejia@illinois.edu;
For questions regarding the search process may be directed to
Ms. Audra Martin, Office Manager, mart@illinois.edu;
For questions regarding the application process, please contact 217-333-2137
The University of Illinois System is an equal opportunity employer, including but not
limited to disability and/or veteran status, and complies with all applicable state and
federal employment mandates. Please visit Required Employment Notices and Posters
to view our non-discrimination statement and find additional information about required
background checks, sexual harassment/misconduct disclosures, COVID-19 vaccination
requirement, and employment eligibility review through E-Verify.
As an equal opportunity employer, all qualified applicants will receive consideration for
employment without regard to race, religion, color, national origin, sex, sexual
orientation, gender identity, age, status as a protected veteran, or status as a qualified
individual with a disability. Illinois welcomes individuals with diverse backgrounds,
experiences, and ideas who embrace and value diversity and inclusivity.
www.inclusiveillinois.illinois.edu
Applicants with disabilities are encouraged to apply and may request a reasonable
accommodation under the Americans with Disabilities Act (2008) to complete the
application and/or interview process. Requests may be submitted through the
reasonable accommodations portal, or by contacting the Accessibility &
Accommodations Division of the Office for Access and Equity at 217-333-0885, or by
emailing accessibility@illinois.edu.
",Faculty Positions,,,,,,,,,,,,
37378085,Assistant or Associate Professor of Statistics,https://jobs.chronicle.com/job/37378085/assistant-or-associate-professor-of-statistics/,False,Rhodes College,"Tennessee, United States",Salary Not specified,2022-12-14,"
Job Title:

Assistant or Associate Professor of Statistics

Department:

Mathematics & Computer Science

Job Description:

The Mathematics & Computer Science Department at Rhodes College
invites applications for a tenure-track position in Applied
Statistics at the level of Assistant or Associate Professor to
begin fall of 2023. Preference will be given to candidates whose
area of specialty broadens our current areas of statistical
application, including candidates working in areas that intersect
with the life sciences, actuarial sciences, data analytics, social
sciences, topics of social justice, or statistics education. Rhodes
College believes that diversity and inclusion are critical to our
success as an institution, and we seek to recruit, develop, and
retain the most talented people from a diverse candidate pool.
Furthermore, Rhodes College is committed to supporting the
work-life alignment of its faculty. The successful candidate must
demonstrate a firm commitment to teaching and scholarship at a
liberal arts college. They will be expected to maintain an active
research program and mentor undergraduates in at least one of the
following areas: (i) academic research, (ii) passing actuarial
exams, (iii) obtaining internships in industry, and (iv) pursuing a
statistics career. Research will be supported by start-up funds and
annual travel funds. Possibilities for additional research support
include annual summer research grants and early leave.
Collaborative research and teaching opportunities exist with
several interdisciplinary programs, including but not limited to
the Environmental Sciences & Studies Program, the Psychology
Department, and the Urban Studies Program. Opportunities also exist
for collaboration with numerous companies and organizations in
Memphis. Rhodes College has existing relationships with St. Jude
Children's Research Hospital, the Memphis Zoo, UT Health Sciences
Center, University of Memphis, FedEx, International Paper,
ServiceMaster, Medtronic, AutoZone, and others. The successful
candidate will teach five classes per year, including introductory
courses using the programming language R, existing upper-level
courses, new courses that align with the candidate's areas of
expertise, and statistics courses in the Data Analytics major
currently under development. Applicants should hold or expect to
receive a Ph.D. in Statistics or a related field (for example,
Applied Mathematics, Data Analytics, Actuarial Science, or other
disciplines that make heavy use of statistics) by August
2023.

Rhodes is a nationally ranked residential college committed to the
liberal arts and sciences. Our highest priorities are intellectual
engagement, service to others, commitment to diversity and
inclusion, and honor among ourselves. Our students live and learn
on one of the country's most beautiful campuses, located in the
heart of Memphis, an economic, medical, and culturally diverse
center, making Rhodes one of a handful of prominent liberal arts
colleges in a major metropolitan area.

Rhodes College prides itself on being a diverse, inclusive, and
welcoming environment. We are an equal opportunity employer
committed to diversity and anti-discrimination .

A complete application will include 1) a cover letter that
addresses the strengths the candidate will bring as a teacher and
scholar to a liberal arts college environment; 2) a curriculum
vitae; 3) a separate statement that addresses how your experiences
with teaching, scholarship, and/or service will contribute to a
college community that includes a commitment to diversity and
inclusion as one of its core values. Also, you must include the
following additional documents: 4) a statement of teaching
philosophy, and 5) a research statement. Review of completed
applications will begin October 1, 2022, and will continue until
the position is filled. Candidates from backgrounds typically
underrepresented in higher education are strongly encouraged to
apply. The names and contact information for three references may
be requested at the committee's discretion. Background checks are
required before candidates can be brought to campus for
interviews.

PI199262704
",Faculty Positions,Science,Technology & Mathematics,Mathematics,Statistics,,,,,,,,
37378224,Assistant Professor of Practice,https://jobs.chronicle.com/job/37378224/assistant-professor-of-practice/?LinkSource=TopJob,True,Purdue University,"West Lafayette, Indiana",competitive,2022-12-14,"The Department of Physics and Astronomy in the College of Science at Purdue University invites applications for a non-tenure track faculty position at the rank of Assistant Professor of Practice. The successful candidate will support the learning and engagement activities of the Department, defined broadly.
Qualifications:  Candidates must have a PhD in Physics or Astronomy or closely related field, with a track record and a commitment to teaching and engagement. Successful candidates will teach at undergraduate and graduate levels, participate in curriculum development for face-to-face and online courses, conduct professional development of teaching assistants, engage in scholarship of teaching and learning, including seeking external funding to support these efforts, dedicate time to committee work related to learning and engagement activities, contribute to recruitment and retention of students, and participate in departmental outreach efforts.
The Department and College:  The Department of Physics and Astronomy has 60 tenured and tenure-track professors, 190 graduate students, and 280 undergraduates. The Department is engaged in research in astrophysics, atomic, molecular, and optical physics, biological physics, condensed matter, high energy, nuclear physics, and physics education, as well as university-wide multidisciplinary research in data science, nanoscience, photonics, and quantum information science involving the Birck Nanotechnology Center, the Purdue Quantum Science and Engineering Institute, and the Colleges of Engineering. For more information, see https://www.physics.purdue.edu/.
The Department of Physics and Astronomy is part of the College of Science, which comprises the physical, computing and life sciences at Purdue. It is the second-largest college at Purdue with over 350 faculty and more than 6000 students. With multiple commitments of significant investment and strong alignment with Purdue leadership, the College is committed to supporting existing strengths and enhancing the scope and impact of the Department of Physics and Astronomy. Purdue itself is one of the nation’s leading land-grant universities, with an enrollment of over 41,000 students primarily focused on STEM subjects. For more information, see https://www.purdue.edu/purduemoves/initiatives/stem/index.php.
Application Procedure:  Applicants should apply electronically at https://careers.purdue.edu/job-invite/22139/
that includes (1) a cover letter, (2) a complete curriculum vitae, and (3) statement of teaching and learning.
Purdue University, the College of Science, and the Department of Physics and Astronomy are committed to advancing diversity in all areas of faculty effort, including discovery, instruction, and engagement. Candidates are encouraged to address in their cover letter how they are prepared to contribute to a climate that values diversity and inclusion. Purdue University, the College of Science, and the Department of Physics and Astronomy are committed to free and open inquiry in all matters. Candidates are encouraged to address in their cover letter how they are prepared to contribute to a climate that values free inquiry and academic freedom.
Additionally, applicants should arrange for three letters of reference to be e-mailed to the Search Chair at popsearch@purdue.edu. Applications will be held in strict confidence and will be reviewed beginning January 30, 2023. Applications will remain in consideration until the position is filled. A background check will be required for employment in this position.
Purdue University is an EOE/AA employer. All individuals, including minorities, women, individuals with disabilities, and veterans are encouraged to apply.
",Faculty Positions,Science,Technology & Mathematics,Physics & Space Sciences,,,,,,,,,
37377968,Assistant/Associate Professor of Social Work - 2858,https://jobs.chronicle.com/job/37377968/assistant-associate-professor-of-social-work-2858/,False,University of North Carolina at Pembroke,"Pembroke, North Carolina",Commensurate Upon Education and Experience,2022-12-14,"Established in 1887 as a school for the education of American Indians, The University of North Carolina at Pembroke serves a distinctly diverse student body and encourages inclusion and appreciation of the values of all people. Located in the heart of Pembroke, N.C., UNCP boasts an enrollment of 8,200 in 41 undergraduate and 18 graduate programs and offers a personalized learning environment where faculty and staff are dedicated to engaged scholarship, high academic standards, creative activity and public service. Spread over 281 acres, the campus offers a sense of community and belonging-–a place where faculty and staff feel supported, take pride in the university’s mission, and are devoted to excellence in teaching, learning and research, and to developing leaders who make a difference in their communities.

The Department of Social Work at the University of North Carolina at Pembroke invites applications for one tenure-track 9-month faculty position at the rank of Assistant/Associate Professor.
The Department of Social Work has both BSW and MSW programs. Programs include advanced standing, part-time and night/evening, and off-campus sites. The successful candidate may be required to teach across the BSW and MSW social work curricula, and field practicum. He/she will provide academic advisement, develop curriculum including on-line courses, and/or teach some courses at off-campus sites. In addition to instructional duties, he/she is required to maintain an active program of scholarship, participate in service activities, and be willing to seek and participate in extramural funding.
Rank is open and depends on the qualifications and achievements of the candidate, but no higher than the rank currently held at another university. Appointment at the rank of Assistant or Associate Professor is preferred.
Minimum Training and Experience Requirements:  A Master of Social Work degree from a CSWE accredited institution is required but a doctoral degree in social work or closely related field is preferred, ABD will be considered; two years post MSW work experience; college/university teaching experience; ability and willingness to teach at online and evening classes; ability to teach multiple areas of the BSW and MSW curricula; willingness to teach/supervise field practicum; potential for scholarship; and willingness to serve on university and departmental committees and provide community services.
Special Instructions to Applicants:  This position is subject to the successful completion of an employment background check. An employment background check includes a criminal background check, employment verification, reference checks, license verification (if applicable) and credit history check (if applicable). In compliance with federal law, all persons hired will be required to verify identity and eligibility to work in the United States and to complete the required employment eligibility verification form upon hire. New employees are paid only by direct deposit to the financial institution of their choice. Candidates claiming Veterans Preference must attach a copy of their DD-214 as a part of the online application process.

UNC Pembroke is an Equal Opportunity Employer. The University prohibits discrimination against qualified individuals based on their status as protected veterans or individuals with disabilities, and prohibits discrimination against all individuals based on their age, race, color, genetic information, religion, sex, sexual orientation, gender identity or expression and national origin. UNC Pembroke is a VEVRAA Federal Contractor and seeks priority referrals of protected veterans for our openings.
",Faculty Positions,Professional Fields,Social Work & Human Services,,,,,,,,,,
